{
  "schema": "adoption-decision/v1",
  "note": "Synthetic example. Not a real project, not a real finding, no live credentials.",
  "source": {
    "repo": "https://github.com/example/risky-payments-sdk",
    "resolved_commit": "a1b2c3d4e5f6g7h8",
    "requested_ref": "v2.4.0"
  },
  "intended_use": {
    "component": "billing webhooks",
    "environment": "production",
    "permissions": [
      "read",
      "process-payments"
    ]
  },
  "manifest": {
    "scanner": "repo-sentinel",
    "ruleset_sha256": "3f4a5b6c7d8e9f0a1b2c3d4e5f6a7b8c9d0e1f2a",
    "manifest_sha256": "9f3c8b7a6e5d4c3b2a1f0e9d8c7b6a5f4e3d2c1b",
    "coverage": "static \u00b7 no execution \u00b7 adopter-safe rendering",
    "acquired_at": "2026-07-27T18:04:12Z"
  },
  "acquisition": {
    "complete": false,
    "omissions": [
      {
        "path": "test-fixtures",
        "kind": "submodule_not_fetched",
        "note": "Recorded as an omission, not a finding. Nothing was read there."
      }
    ]
  },
  "findings": [
    {
      "id": "log-before-verify-1",
      "path": "apps/webhooks/handler.ts",
      "line": 320,
      "severity": "HOLD",
      "adopter_can_verify": true,
      "summary": "Full webhook payload is logged before the signature is verified.",
      "why_it_matters": "An unverified caller can write attacker-controlled content into logs, and payment payloads carry PII.",
      "owner_only_signals": [],
      "reproduction_or_verification": "Read apps/webhooks/handler.ts around line 320. The log call precedes verifySignature()."
    },
    {
      "id": "undocumented-flag-1",
      "path": "lib/env.ts",
      "line": 30,
      "severity": "HOLD",
      "adopter_can_verify": true,
      "summary": "PAYMENT_SDK_TEST_MODE disables rate limiting and is absent from the README.",
      "why_it_matters": "A flag that changes production behaviour and is not documented cannot be reasoned about by an adopter.",
      "owner_only_signals": [],
      "reproduction_or_verification": "Read lib/env.ts; compare against README.md, which does not mention the variable."
    }
  ],
  "unresolvable": [
    {
      "question": "How long are webhook logs retained?",
      "why": "Only the maintainer can answer. Retention is not observable from source.",
      "blocks": "log-before-verify-1"
    }
  ],
  "verdict": {
    "recommendation": "HOLD",
    "not_a_certification": true,
    "conditions_for_accept": [
      "Written confirmation that webhook logs rotate within 24 hours, or that payloads are redacted before write."
    ],
    "expires_when": [
      "resolved_commit changes",
      "intended_use changes",
      "ruleset_sha256 changes"
    ]
  },
  "authorization": {
    "authorized_by": null,
    "authorized_at": null,
    "note": "Left null on purpose. Authorization is a human act and this file cannot perform it."
  }
}
